doc_num,consolidationyear,instrumentNumber,longtitle,modifiedyear,registrationyear,regulationmaker,topic 1,topic 2,overarching topic
doc_1439,2018,SOR/90-530,Order Respecting the Marketing in Interprovincial and Export Trade of Milk Produced in Manitoba,2005,1990,,dairy,no topic,agriculture / food
doc_1441,2018,SOR/99-123,Toronto/Lester B. Pearson International Airport Zoning Regulations,2011,1999,P.C.,road,no topic,road
doc_1446,2018,SOR/2014-10,Icewine Regulations,2014,2014,P.C.,vehicle / engine,wine,automobile
doc_1449,2018,"C.R.C., c. 1511",Regulations Respecting Supplementary Retirement Benefits,2005,NA,,numbers / monthly instalment,no topic,insurance
doc_1453,2018,SOR/96-207,"Order Granting Privileges and Immunities to the Hong Kong Economic and Trade Office, and Persons Connected Therewith, in Canada",2008,1996,,tariff,no topic,tariff
doc_1454,2018,SOR/93-430,Order Respecting the Remission of Customs Duties on Certain Products,2008,1993,P.C.,tariff,no topic,tariff
doc_1455,2018,SOR/93-17,Rules of Practice and Procedure of the Royal Canadian Mounted Police Public Complaints Commission,2011,1992,,regulated products,no topic,commodities
doc_1456,2018,SOR/2010-259,Ontario Grapes-for-Processing Marketing Levies Order,2010,2010,,food / grape grower,no topic,agriculture / food
doc_1457,2018,"C.R.C., c. 1539",Order Withdrawing from Disposal Certain Lands in the Northwest Territories for the Purpose of an Airstrip,2005,NA,,first nation,ferry,first nation
doc_1460,2018,SOR/2010-270,Pacific Aquaculture Regulations,2010,2010,P.C.,"products (gold, silver)",no topic,commodities
doc_1463,2018,"C.R.C., c. 1504",Order Prescribing the Time at Which and Manner in Which Import and Export Returns Shall Be Sent,2005,NA,,vehicle / engine,first nation,automobile
doc_1465,2018,SOR/94-667,Regulations Respecting the Ownership and Control of Canadian Telecommunications Common Carriers,2008,1994,P.C.,share / carrier,no topic,share / carrier
doc_1467,2018,SOR/98-443,Environmental Assessment Review Panel Service Charges Order,2012,1998,,tariff,no topic,tariff
doc_1470,2018,SOR/2007-79,Fort McKay First Nation Oil Sands Regulations,2007,2007,P.C.,first nation,no topic,first nation
doc_1471,2018,SOR/2013-24,Heavy-duty Vehicle and Engine Greenhouse Gas Emission Regulations,2013,2013,P.C.,vehicle / engine,no topic,automobile
doc_1472,2018,SOR/2002-163,Guidelines Respecting Control in Fact for the Purpose of Subsection 377(1) of the ,2005,2002,,bank / finance,no topic,bank / finance
doc_1473,2018,SOR/86-1026,Regulations Respecting Ferry Cables in Navigable Waters,2011,1986,P.C.,ferry,no topic,ship / vessel
doc_1474,2018,SOR/2009-68,Critical Habitats of the Northeast Pacific Northern and Southern Resident Populations of the Killer Whale (Orcinus orca) Order,2009,2009,,water,no topic,water
doc_1476,2018,"C.R.C., c. 1048",Regulations Respecting the Administration and Distribution of the Estates of Deceased Members of the Canadian Forces,2005,NA,,estate,no topic,estate / land
doc_1477,2018,SOR/92-352,Regulations Respecting the Protection and Maintenance of Assets of Banks,2005,1992,P.C.,bank / finance,no topic,bank / finance
doc_1479,2018,SOR/2011-249,Transfer of Portions of the Financial Transactions and Reports Analysis Centre of Canada Regulations,2011,2011,P.C.,hearing / application,voting,appeal / hearing
doc_1481,2018,SOR/2013-7,Unsolicited Telecommunications Fees Regulations,2013,2013,,first nation,no topic,first nation
doc_1483,2018,SOR/2001-275,Disposal at Sea Regulations,2006,2001,P.C.,waste matter,no topic,hazardous waste
doc_1485,2018,SOR/93-169,Regulations Respecting Business Improvement Loans to Small Businesses,2008,1993,P.C.,loan,no topic,loan
doc_1487,2018,SOR/73-558,Regulations Respecting a Loan for Housing for Rosabel Jeanette Pryce,2005,1973,P.C.,loan,wine,loan
doc_1488,2018,SOR/94-303,Regulations Respecting the Disposition of Seized Property,2009,1994,P.C.,installation / equipment,no topic,equipment
doc_1489,2018,SOR/83-196,Regulations Respecting the Manner in which Human Rights Complaints relating to Customs and Excise will be Investigated,2005,1983,P.C.,crime / criminal code,no topic,criminal code / immunity
doc_1490,2018,SOR/98-127,"Repayment of Receipts Regulations, 1997",2008,1998,T.B.,commission,no topic,commission
doc_1492,2018,SOR/95-104,Regulations Respecting Petroleum Installations Used in Areas Offshore Newfoundland under the Canada-Newfoundland Atlantic Accord Implementation Act,2008,1995,P.C.,installation / equipment,no topic,equipment
doc_1493,2018,SOR/2017-40,Order Designating New Brunswick for the Purposes of the Criminal Interest Rate Provisions of the Criminal Code,2017,2017,P.C.,vehicle / engine,crime / criminal code,automobile
doc_1494,2018,SOR/99-308,Tariff of Costs,2008,1999,P.C.,hearing / application,hearing,appeal / hearing
doc_1497,2018,SOR/86-951,"Regulations Respecting the Method to be Followed in Determining the Tariff Classification of Sugar, Molasses and Sugar Syrup",2010,1986,P.C.,"products (gold, silver)",no topic,commodities
doc_1500,2018,SOR/89-297,Newfoundland Rules of Practice Respecting Applications and Hearings Concerning a Reduction in the Number of Years of Imprisonment without Eligibility for Parole,2011,1989,,judiciary,no topic,judiciary
doc_1501,2018,SOR/2014-278,"Textiles and Apparel Remission Order, 2014",2014,2014,P.C.,concession,no topic,concession
doc_1503,2018,SOR/2015-86,First Nations Elections Regulations,2015,2015,P.C.,election,no topic,election
doc_1504,2018,SOR/2016-194,Textile Flammability Regulations,2016,2016,P.C.,textile / water,no topic,water
doc_1508,2018,SOR/2001-473,Disclosure on Account Opening by Telephone Request (Trust and Loan Companies) Regulations,2008,2001,P.C.,"products (gold, silver)",bank / finance,commodities
doc_1510,2018,SOR/2016-180,Infant Feeding Bottle Nipples Regulations,2016,2016,P.C.,infant / baby,no topic,baby products
doc_1514,2018,SOR/80-647,Regulations Respecting the Marketing in Interprovincial and Export Trade of Mushrooms Produced in British Columbia,2010,1980,,regulated products,no topic,commodities
doc_1516,2018,SOR/2002-229,Immigration Division Rules,2008,2002,P.C.,hearing / application,no topic,appeal / hearing
doc_1517,2018,SOR/2012-215,Marketing Authorization for Food Additives That May Be Used as Yeast Foods,2012,2012,,concession,food,concession
doc_1518,2018,SOR/2004-293,Listed Airport Regulations,2005,2004,P.C.,infant / baby,no topic,baby products
doc_1519,2018,SOR/2014-293,Commissioner’s Standing Orders (General Administration),2014,2014,,member / subsidiary,bank / finance,member / subsidiary
doc_1525,2018,SOR/88-292,Order Granting Authority to Regulate the Marketing in Interprovincial and Export Trade of Cattle Produced in Prince Edward Island,2005,1988,P.C.,marketing,hearing / application,marketing
doc_1526,2018,SOR/98-37,Mexico Deemed Direct Shipment (General Preferential Tariff) Regulations,2008,1997,P.C.,installation / equipment,tariff,equipment
doc_1529,2018,"C.R.C., c. 1302",Order Designating the Minister for the Purposes of the Precious Metals Marking Act,2005,NA,,member / subsidiary,"products (gold, silver)",member / subsidiary
doc_1530,2018,SOR/2015-241,Critical Habitat of the Westslope Cutthroat Trout (Oncorhynchus clarkii lewisi) Alberta Population Order,2015,2015,,exploratory work,no topic,exploratory work
doc_1531,2018,"C.R.C., c. 1316","Order Respecting Privileges and Immunities for the International North Pacific Fisheries Commission and for its Representatives, Officials and Experts",2005,NA,,ship / accident,no topic,ship / vessel
doc_1534,2018,SOR/2013-238,New Brunswick Blueberry Order,2014,2013,P.C.,marketing,no topic,marketing
doc_1535,2018,SOR/85-514,"Regulations Respecting the Reporting of Shipping Casualties, Accidents, Dangerous Occurrences, Deaths and Disappearances of Persons on Ships",2007,1985,P.C.,ship / accident,no topic,ship / vessel
doc_1537,2018,SOR/93-592,Order Specifying Limits on the Aggregate Quantity of Goods set out in Subsection 74(3) of the Customs Tariff that Are Entitled to the Benefit of the Mexico Tariff,2008,1993,P.C.,installation / equipment,no topic,equipment
doc_1538,2018,SOR/64-444,Canadian Forces Compulsory Early Superannuation Regulations,2006,1964,P.C.,share / carrier,brunswick,share / carrier
doc_1539,2018,SOR/80-337,Regulations Respecting a Drawback on Customs Duties Paid on Toy Skins Used in the Manufacture of Stuffed Toys,2005,1980,P.C.,manufacture,no topic,manufacture
doc_1541,2018,SOR/2002-75,Quebec Rules of Practice Respecting Reduction in the Number of Years of Imprisonment without Eligibility for Parole,2014,2002,,first nation,no topic,first nation
doc_1542,2018,"C.R.C., c. 535",Order Respecting the Marking of Goods Imported into Canada,2005,NA,,goods / steel,no topic,commodities
doc_1544,2018,SOR/2003-204,Continuation of Amalgamated or Merged Corporations Regulations,2005,2003,P.C.,administration enforcement,legal policies,administration enforcement
doc_1545,2018,SOR/2006-355,Order Issuing a Direction to the CRTC on Implementing the Canadian Telecommunications Policy Objectives,2007,2006,P.C.,railway,no topic,railway
doc_1546,2018,SOR/2016-25,Canada Oil and Gas Operations Administrative Monetary Penalties Regulations,2016,2016,P.C.,ocean pollution,no topic,water
doc_1547,2018,SOR/2013-209,Prepaid Payment Products Regulations,2013,2013,P.C.,water emissions,no topic,water
doc_1548,2018,SOR/95-257,"Regulations Prescribing the Time and the Manner for the Crediting of Amounts by the Minister of Natural Resources to the Newfoundland Offshore Petroleum Resource Revenue Fund, and the Time and the Manner for the Payment, to Her Majesty in Right of Newfoundland, of any Amount Credited to that Fund",2008,1995,P.C.,national relations,no topic,national relations
doc_1549,2018,SOR/2005-59,Federal Public Sector Labour Relations Act Separate Agency Designation Order,2006,2005,P.C.,labour relations,no topic,employment
doc_1550,2018,SOR/91-101,Regulations Respecting Zoning at Rimouski Airport,2011,1991,P.C.,geography,airport,geography
doc_1551,2018,SOR/72-395,Regulations Respecting the Determination and Payment out of the Foreign Claims Fund of certain Claims Against the Government of The Polish People’s Republic and its Citizens,2006,1972,P.C,claims,no topic,claims
doc_1553,2018,SOR/2016-19,Canada–Newfoundland and Labrador Offshore Petroleum Administrative Monetary Penalties Regulations,2016,2016,P.C.,natural resources,no topic,environment
doc_1554,2018,SOR/2011-10,"Marine Spark-Ignition Engine, Vessel and Off-Road Recreational Vehicle Emission Regulations",2011,2011,P.C.,water emissions,no topic,water
doc_1555,2018,SOR/2017-177,CETA Tariff Preference Regulations,2017,2017,P.C.,documentary,appeals,documentary
doc_1556,2018,"C.R.C., c. 276",Regulations Respecting the Information Required from Persons Engaged in the Marketing in Interprovincial and Export Trade of Hogs Produced in Saskatchewan,2005,NA,,water treatment,no topic,water
doc_1557,2018,SOR/2013-221,Electronic Commerce Protection Regulations,2013,2013,P.C.,national security,no topic,national security
doc_1558,2018,"C.R.C., c. 1482",Regulations Respecting Elevators in Ships,2005,NA,,accessibility,no topic,accessibility
doc_1559,2018,SOR/87-150,"Regulations Respecting the Minimum Qualification Standards for Locomotive Engineers, Transfer Hostlers, Conductors and Yard Foremen",2009,1987,,railway,no topic,railway
doc_1564,2018,SOR/97-144,"Broadcasting Licence Fee Regulations, 1997",2005,1997,,radio,no topic,communication
doc_1570,2018,SOR/93-172b,"Regulations Respecting the Employment of Persons for One or More Specified Periods of Less Than Three Months Totalling Less Than Six Months in the Aggregate During Any Consecutive 12-Month Period in the Department of External Affairs in the Clerical and Regulatory Group and the Secretarial, Stenographic, Typing Group of the Administrative Support Category, in the Administrative Services Group of the Administrative and Foreign Service Category, and in the Social Science Support Group of the Technical Category During the Period Beginning on April 1, 1993 and Ending on December 31, 1993",2006,1993,P.C.,group service,no topic,group service
doc_1571,2018,"C.R.C., c. 1333",Regulations Applying the Public Service Employment Act to Officers of the Canadian Penitentiary Service,2011,NA,,airport zoning,ocean pollution,airport / aircrafts
doc_1572,2018,SOR/2008-247,Sex Offender Information Registration Regulations (Canadian Forces),2008,2008,P.C.,national defence,no topic,army / defence
doc_1576,2018,SOR/2011-132,CCOFTA Rules of Origin for Casual Goods Regulations,2011,2011,P.C.,international communications,no topic,international policy
doc_1579,2018,SOR/2016-166,Carbonated Beverage Glass Containers Regulations,2016,2016,P.C.,landfill,no topic,environment
doc_1580,2018,SOR/2002-230,Immigration Appeal Division Rules,2008,2002,P.C.,water emissions,no topic,water
doc_1582,2018,SOR/2012-230,New Classes of Practitioners Regulations,2012,2012,P.C.,health care,no topic,health
doc_1583,2018,"C.R.C., c. 712",Order Pursuant to Section 13 of the Financial Administration Act Authorizing the Minister of Agriculture to Prescribe Certain Fees,2005,NA,,national railways,trade,railway
doc_1585,2018,SOR/2002-224,"Radiocommunication Act (Subsection 4(1) and Paragraph 9(1)(b)) Exemption Order (Security and Safety, International Relations and National Defence), No. 2002-2",2008,2002,P.C.,radio tarrifs,no topic,tariff
doc_1586,2018,SOR/2016-172,Corded Window Covering Products Regulations,2016,2016,P.C.,water emissions,railway,water
doc_1587,2018,"C.R.C., c. 10",Regulations Prescribing Compensation for Bodily Injury or Death Resulting from Flights Undertaken in the Course of Duty,2005,NA,,employee compensation,no topic,benefits
doc_1589,2018,SOR/2012-96,Kimmirut Airport Zoning Regulations,2012,2012,P.C.,geography,airport planning,geography
doc_1590,2018,SOR/85-900,Regulations Respecting the Means of Determining the Equivalent Dollar Value of Currencies of Other Countries for the Purpose of Computing the Value for Duty for Customs Purposes,2005,1985,P.C.,exchange rate,no topic,economics
doc_1591,2018,SOR/2014-275,Grade Crossings Regulations,2014,2014,P.C.,railway crossings,no topic,railway
doc_1592,2018,SOR/92-67,Regulations Respecting Zoning at Spence Bay Airport,2011,1992,P.C.,geography,airport,geography
doc_1593,2018,SOR/2004-275,Firearms Marking Regulations,2005,2004,P.C.,firearms,no topic,firearms
doc_1596,2018,SOR/86-948,"Regulations Respecting the Drawback of Taxes Paid on Goods Manufactured or Produced in Canada that are Supplied as Ships’ Stores, Used for the Equipment, Repair or Reconstruction of Ships or Aircraft or Delivered to Telegraph Cable Ships Proceeding on an Ocean Voyage for Use in Laying or Repairing Oceanic Telegraph Cables Outside Canadian Territorial Waters",2006,1986,P.C.,telecommunication commission,no topic,communication
doc_1597,2018,SOR/65-262,Pensionable Service Order,2006,1965,P.C.,food preparation,no topic,agriculture / food
doc_1599,2018,SOR/97-80,General Import Permit No. 6 — Roses for Personal Use,2008,1996,,legal policies,no topic,legal
doc_1600,2018,SOR/2017-201,Montréal–Pierre Elliott Trudeau International Airport Zoning Regulations,2017,2017,P.C.,geography,no topic,geography
doc_1602,2018,"C.R.C., c. 672",Regulations Respecting the Assignment of the Right of Organizations under Subsection 12(1) of the Advance Payments for Crops Act,2005,NA,,banking,sports,bank / finance
doc_1603,2018,"C.R.C., c. 114",Regulations Respecting Zoning at Saint John Airport,2012,NA,,geography,national railways,geography
doc_1604,2018,SOR/2002-422,Order Specifying the Royal Canadian Mounted Police for the Purposes of the Employment Equity Act,2006,2002,P.C.,airport zoning,telecommunications,airport / aircrafts
doc_1605,2018,SOR/2013-143,"Regulations Establishing the Periods Within Which Eligible Authors, Eligible Performers and Eligible Makers not Represented by Collective Societies Can Claim Private Copying Remuneration",2013,2013,,tobacco tarrifs,no topic,tobacco
doc_1607,2018,SOR/2007-201,Agricultural Product Priority Claim (Banks) Regulations,2007,2007,P.C.,administration enforcement,marine organisms,administration enforcement
doc_1609,2018,SOR/2018-119,Scott Islands Protected Marine Area Regulations,2018,2018,P.C.,wildlife protection in airport planning,no topic,wild life
doc_1611,2018,SOR/97-540,Order Prohibiting the Issuance of Interests at Rampart House in the Yukon Territory,2008,1997,P.C.,documentary,no topic,documentary
doc_1612,2018,SOR/82-405,Order Designating Special Areas in the Province of Quebec and Ontario and Approving a Plan for the Areas,2011,1982,P.C.,census,no topic,census
doc_1615,2018,"C.R.C., c. 1045",Regulations Respecting Dental Treatment by Civilian Practitioners for Personnel of the Canadian Forces,2005,NA,,dental,no topic,health
doc_1616,2018,SOR/2014-301,CKFTA Tariff Preference Regulations,2015,2014,P.C.,documentary,no topic,documentary
doc_1617,2018,SOR/89-488,Order Varying Certain National Transportation Agency Orders Respecting Railway Companies,2011,1989,P.C.,national railways,no topic,railway
doc_1618,2018,SOR/97-568,Recovery of Overpayments Made to Former Members of Parliament Regulations,2008,1997,P.C.,administration enforcement,no topic,administration enforcement
doc_1619,2018,SOR/2011-250,Transfer of Portions of the Parks Canada Agency Regulations,2011,2011,P.C.,airport zoning,labour relations,airport / aircrafts
doc_1620,2018,SOR/2005-106,Order Suspending the Application of Concessions On Imports of Certain Products Originating in the United States,2005,2005,P.C.,railway tarrifs,no topic,railway
doc_1622,2018,SOR/2005-112,International Cospas-Sarsat Programme Privileges and Immunities Order,2005,2005,P.C.,immunity,no topic, criminal code / immunity
doc_1626,2018,SOR/98-466,Regulations Prescribing Public Officers,2008,1998,P.C.,administration enforcement,no topic,administration enforcement
doc_1627,2018,SOR/87-91,Order Authorizing the Minister of State (Privatization and Regulatory Affairs) to Exercise the Powers Given to the Minister of Fisheries and Oceans Under the Act in Respect of Certain Companies,2005,1987,P.C.,fishery,no topic,fishery
doc_1628,2018,SOR/81-707,Regulations Respecting Zoning at Inuvik Airport,2011,1981,P.C.,geography,airport,geography
doc_1629,2018,SOR/95-479,Regulations Respecting the Report on the State of Canada’s Forests,2005,1995,P.C.,administration enforcement,lumber shipments,administration enforcement
doc_1630,2018,SOR/2012-152,"Wheat and Barley Research, Market Development and Technical Assistance Regulations",2012,2012,P.C.,exchange rate,no topic,economics
doc_1631,2018,SOR/2010-282,Credit Enhancement Fund Use Regulations,2010,2010,P.C.,employee compensation,no topic,benefits
doc_1632,2018,"C.R.C., c. 316",Regulations Providing for Adjustment Assistance to Displaced Workers in Textile and Clothing Industries,2006,NA,,employee benefits,no topic,benefits
doc_1633,2018,SOR/2002-146,Regulations Excluding Certain Things from the Definition of “Goods” under the Preclearance Act,2008,2002,P.C.,administration enforcement,northern development,administration enforcement
doc_1635,2018,SOR/76-40,Regulations Respecting the Extension for a Further Twenty Year Period of the Final Licence for the Development of Water Power at a Site on the Astoria River in Jasper National Park in the Province of Alberta,2008,1975,P.C.,power census,no topic,energy / pipeline / oil
doc_1638,2018,SOR/2012-146,Cost Recovery Regulations,2012,2012,P.C.,administration enforcement,no topic,administration enforcement
doc_1639,2018,SOR/2005-338,Fenner Dunlop (Bracebridge) Inc. Remission Order,2006,2005,P.C.,railway,radio tarrifs,railway
doc_1641,2018,"C.R.C., c. 1521",Order Respecting the Granting of Exploratory Permits upon Tender for Canada Lands Returned to Her Majesty,2006,NA,,urban planning,no topic,estate / land
doc_1642,2018,SOR/2010-241,Electronic Documents (Insurance and Insurance Holding Companies) Regulations,2010,2010,P.C.,consent,consent,consent
doc_1643,2018,"C.R.C., c. 1247",Regulations Respecting the Payment of Expenses of Parliamentary Secretaries,2005,NA,,parlimentary secretary,no topic,parliament
doc_1644,2018,SOR/94-12,Order Respecting the Imposition of a Surtax on Boneless Beef Imported into Canada,2008,1993,P.C.,food preparation,no topic,agriculture / food
doc_1645,2018,SOR/2014-117,Electronic Documents and Electronic Information Regulations,2014,2014,P.C.,employee benefits,no topic,benefits
doc_1647,2018,"C.R.C., c. 1535","Order Withdrawing from Disposal, Setting Apart and Appropriating Certain Lands in the Northwest Territories for the Purpose of a National Park",2005,NA,,geography,urban planning,geography
doc_1648,2018,SOR/2004-102,"Rules of Practice and Procedure of the Tax Court of Canada in Respect of Appeals Under the Excise Act, 2001 (Informal Procedure)",2007,2004,P.C.,appeals,no topic,appeal / hearing
doc_1649,2018,SOR/2005-311,Department of Employment and Social Development Regulations,2006,2005,P.C.,administration enforcement,no topic,administration enforcement
doc_1650,2018,SOR/2010-240,Electronic Documents (Trust and Loan Companies) Regulations,2010,2010,P.C.,consent,consent,consent
doc_1651,2018,"C.R.C., c. 1520",Order Respecting the Granting of Oil and Gas Leases upon Tender for Canada Lands Returned to Her Majesty,2006,NA,,lease violations,no topic,lease
doc_1654,2018,SOR/94-680,Order Respecting the Remission of Customs Duties on Certain Guitar Parts,2008,1994,P.C.,musical instruments,no topic,musical instruments
doc_1655,2018,SOR/96-544,Discretionary Interest By-Law,2008,1996,,bond ownership,administration enforcement,bond ownership
doc_1657,2018,SOR/94-119,Regulations Respecting Zoning at Fort McPherson Airport,2011,1994,P.C.,airport,no topic,airport / aircrafts
doc_1659,2018,"C.R.C., c. 317",Regulations Respecting Provision for Adjustment Assistance Benefits for Displaced Workers In The Footwear and Tanning Industries,2006,NA,,employee benefits,no topic,benefits
doc_1660,2018,SOR/2016-211,Emergency Order for the Protection of the Western Chorus Frog (Great Lakes / St. Lawrence — Canadian Shield Population),2016,2016,P.C.,Quebec geogaphy,no topic,Quebec geogaphy
doc_1661,2018,SOR/2002-147,Passenger Information Regulations (Preclearance Act),2005,2002,P.C.,airtravel passengers rights,no topic,airport / aircrafts
doc_1662,2018,SOR/88-315,Regulations Respecting the Election of Council Members for the Cree Bands and the Naskapi Band,2011,1988,P.C.,elections,no topic,election
doc_1666,2018,SOR/81-706,Regulations Respecting Zoning at Fort Simpson Airport,2011,1981,P.C.,geography,airport zoning,geography
doc_1667,2018,SOR/2007-49,FIFA Men's U-20 World Cup Canada 2007 Remission Order,2007,2007,P.C.,railway,no topic,railway
doc_1668,2018,SOR/88-467,"Order Authorizing the Acquisition, from Gulf + Western Industries, Inc. or any of its Subsidiaries, by the Canada Development Investment Corporation of Shares Representing Fifty-one Per Cent of a Corporation To Be Created which will own the Businesses of Ginn and Company (Canada), Formerly a Division of Xerox Canada Inc., and GLC Publishers Limited",2010,1988,P.C.,telecommunications,no topic,communication
doc_1670,2018,SOR/2000-54,Prescribed Deposits (Banks without Deposit Insurance) Regulations,2005,2000,P.C.,bond ownership,banking,bond ownership
doc_1673,2018,SOR/2001-251,Albania and the Sultanate of Oman Goods Remission Order,2008,2001,P.C.,musical instruments,no topic,musical instruments
doc_1674,2018,SOR/2008-124,Bowie Seamount Marine Protected Area Regulations,2008,2008,P.C.,marine protection,no topic,water
doc_1675,2018,"C.R.C., c. 1050",Regulations Respecting Training Leave for Reserve Forces,2005,NA,,musical instruments,no topic,musical instruments
doc_1676,2018,SOR/2014-300,CKFTA Rules of Origin for Casual Goods Regulations,2015,2014,P.C.,international communications,no topic,international policy
doc_1677,2018,SOR/2000-1,Certain Canada Port Authorities Divestiture Regulations,2008,1999,T.B.,airport,no topic,airport / aircrafts
doc_1679,2018,"C.R.C., c. 868",Regulations Defining Fitness and Amateur Sport,2006,NA,,sports,no topic,sports
doc_1680,2018,SOR/2011-251,Transfer of Portions of the National Research Council of Canada Regulations,2011,2011,P.C.,airport zoning,labour relations,airport / aircrafts
doc_1681,2018,SOR/97-569,British Columbia Rules of Practice Respecting Reduction in the Number of Years of Imprisonment Without Eligibility for Parole,2009,1997,,legal policies,no topic,legal
doc_1682,2018,"C.R.C., c. 698",Regulations Respecting Domestic Bonds of the Government of Canada,2005,NA,,bond ownership,no topic,bond ownership
doc_1685,2018,SOR/94-496,Order Varying Decision No. 712-W-1993 of the National Transportation Agency,2008,1994,P.C.,immigration,no topic,immigration
doc_1687,2018,SOR/89-30b,"Regulations Respecting the Appointment of Target Group Members to Positions Within the Employment Equity Programs During the Period Beginning on January 1, 1989 and Ending on March 31, 1993",2011,1988,P.C.,airport zoning,no topic,airport / aircrafts
doc_1688,2018,SOR/2002-351,Order Raising the Limit on the Amount that the Canadian Broadcasting Corporation may Expend Under a Lease or Other Rental Agreement,2005,2002,P.C.,railway tarrifs,no topic,railway
doc_1689,2018,SOR/2001-286,"Regulations Respecting the Handling, Offering for Transport and Transportation of Dangerous Goods",2006,NA,,national security,no topic,national security
doc_1690,2018,SOR/2017-200,John C. Munro Hamilton International Airport Zoning Regulations,2017,2017,P.C.,geography,no topic,geography
