doc_num,consolidationyear,instrumentNumber,longtitle,modifiedyear,registrationyear,regulationmaker,topic 1,topic 2,overarching topic
doc_720,2018,SOR/93-74,Regulations Respecting Zoning at Gore Bay Airport,2011,1993,P.C.,road allowance,no topic,road
doc_721,2018,SOR/87-705,Regulations Respecting Zoning at Prince Albert Airport,2011,1987,P.C.,road allowance,no topic,road
doc_722,2018,SOR/85-1003,Order Waiving the Reservation to the Crown with Respect to Certain Territorial Lands in the Northwest Territories,2016,1985,P.C.,marine,no topic,ship / vessel
doc_723,2018,SOR/82-641,Rules Of Procedure of the National Farm Products Marketing Council with Regard to the Conduct of Hearings under Section 8 of the Act,2010,1982,,council proceeding,no topic,appeal / hearing
doc_724,2018,SOR/99-182,Insurance Companies Assessed Expenses Recovery Regulations,2008,1999,P.C.,company insurance,publication,insurance
doc_725,2018,SOR/2016-281,Critical Habitat of the Roseate Tern (Sterna dougallii) Order,2016,2016,,tariff,no topic,tariff
doc_727,2018,SOR/86-259,Regulations Prescribing the Types of Information that the Minister of National Health and Welfare may Require under Paragraph 13(a) of the Canada Health Act in Respect of Extra-Billing and User Charges and the Times at which and the Manner in which such Information shall be Provided by the Government of each Province,2010,1986,P.C.,information,no topic,information
doc_728,2018,SOR/93-485,Regulations Prescribing the Fee To Be Paid for the Verification of a Criminal Record for Civil Purposes,2008,1993,P.C.,eucalyptol,no topic,eucalyptol
doc_729,2018,SOR/98-420,Imports of Certain Textile and Apparel Goods from Mexico or the United States Customs Duty Remission Order,2008,1998,P.C.,free trade,no topic,trade
doc_730,2018,"C.R.C., c. 378",Direction Issued to the Canadian Radio-Television and Telecommunications Commission Respecting the Reservation of Cable Channels,2005,NA,,marine,no topic,ship / vessel
doc_731,2018,"C.R.C., c. 1598",Regulations made pursuant to the Visiting Forces Act,2011,NA,,prison,no topic,criminal code / immunity
doc_732,2018,SOR/90-234,Order Prescribing the Fee To Be Paid by a Person to whom a Service is Provided in Respect of a Request for an Advance Income Tax Ruling from the Department of National Revenue,2008,1990,,national revenue,no topic,national revenue
doc_734,2018,SOR/2009-199,CEFTA Rules of Origin for Casual Goods Regulations,2009,2009,P.C.,radiation / nuclear,no topic,nuclear
doc_738,2018,SOR/2007-32,Reserve Force Pension Plan Regulations,2007,2007,T.B.,pension,no topic,pension
doc_739,2018,SOR/2003-313,"Proclamation Declaring that the Government Corporations Operation Act is Applicable to Parc Downsview Park Inc. beginning on September 16, 2003",2005,2003,,commission meeting,no topic,commission
doc_741,2018,SOR/97-506,United States Barley and Barley Products Remission Order,2008,1997,P.C.,tariff,no topic,tariff
doc_743,2018,SOR/2015-168,Mutual Property and Casualty Insurance Company with Non-mutual Policyholders Conversion Regulations,2015,2015,P.C.,policyholder,no topic,police
doc_745,2018,SOR/92-325,Regulations Specifying the Circumstances Under Which a Natural Person is Affiliated With a Bank,2005,1992,P.C.,bank / marketing,no topic,bank / finance
doc_746,2018,SOR/97-11,Regulations Respecting the Use by a Company or Foreign Company of Information Supplied by its Customers,2008,1996,P.C.,company insurance,no topic,insurance
doc_747,2018,"C.R.C., c. 185",Regulations Respecting the Licensing in Interprovincial and Export Trade of Persons Engaged in the Marketing of Flue-Cured Tobacco Produced in Ontario,2005,NA,,directions,tobacco,directions
doc_748,2018,SOR/2008-163,Material Banking Group Percentage Regulations,2008,2008,P.C.,energy / pipeline,road allowance,energy / pipeline / oil
doc_750,2018,SOR/82-480,Regulations Respecting Reservations for Airport Apron and Terminal Facilities for Passenger Charter Flights,2005,1982,P.C.,airport,no topic,airport / aircrafts
doc_751,2018,SOR/81-543,Area Control List,2005,1981,P.C.,directions,no topic,directions
doc_754,2018,SOR/84-360,Order Respecting the Privileges and Immunities of the African Development Bank in Canada,2005,1984,P.C.,commission meeting,no topic,commission
doc_755,2018,SOR/2013-139,Administrative Monetary Penalties Regulations (Canadian Nuclear Safety Commission),2013,2013,P.C.,radiation / nuclear,no topic,nuclear
doc_760,2018,"C.R.C., c. 967",Regulations Respecting Adjustment Assistance to Consolidated Computer Inc.,2006,NA,,load / automobile,private lender,automobile
doc_762,2018,SOR/92-279,Regulations Restricting Dealing in Canada in Securities by a Bank,2005,1992,P.C.,load / automobile,bank / finance,automobile
doc_764,2018,SOR/2001-404,Minority Investment (Insurance Companies) Regulations,2008,2001,P.C.,entity insurance,no topic,insurance
doc_765,2018,SOR/80-803,Zoning Regulations Respecting Comox Airport,2011,1980,P.C.,directions,no topic,directions
doc_766,2018,"C.R.C., c. 797",Order Respecting the Remission of Sales Tax on Machinery on which Customs Duties are Remitted Pursuant to Certain Tariff Items,2005,NA,,pension,directions,pension
doc_767,2018,SOR/81-49,Order Granting Authority to Regulate the Marketing of Vegetables in British Columbia,2011,1981,P.C.,food,no topic,agriculture / food
doc_768,2018,SOR/2009-204,The Micronutrient Initiative Divestiture Regulations,2009,2009,T.B.,pension,micronutrient,pension
doc_771,2018,SOR/2001-376,Entity Associated with a Foreign Bank Regulations,2005,2001,P.C.,vessel,no topic,ship / vessel
doc_772,2018,SOR/2001-410,Name Use in Securities-related Transactions (Insurance Companies and Insurance Holding Companies) Regulations,2008,2001,P.C.,railway,insurance,railway
doc_773,2018,SOR/92-21,Regulations Respecting Zoning at Weyburn Airport,2011,1991,P.C.,airport,no topic,airport / aircrafts
doc_774,2018,SOR/88-79,Regulations Prescribing the Period within which Goods May Remain in Temporary Storage in an Intermediate Country before They Are Deemed Not To Have Been Shipped Directly to Canada,2011,1987,P.C.,export,ontario,exports
doc_777,2018,"C.R.C., c. 768",Order Respecting the Remission of Taxes Imposed Under Division III of Part IX and Under any Other Part of the Excise Tax Act on Goods for Use in Cases of Emergency,2005,NA,,export,train export,exports
doc_778,2018,SOR/2016-108,Regulations Establishing a List of Spill-treating Agents (Canada Oil and Gas Operations Act),2016,2016,,diving operation,food,diving operation
doc_779,2018,"C.R.C., c. 81",Regulations Respecting Zoning at Edmonton International Airport,2011,NA,,airport,no topic,airport / aircrafts
doc_781,2018,SOR/78-415,Regulations Respecting Enterprise Development Program Assistance to Canada Cycle and Motor Company,2006,1978,P.C.,detainee,vessel / cargo,criminal code / immunity
doc_782,2018,SOR/2001-389,Financial Leasing Entity Regulations,2006,2001,P.C.,financial,no topic,finance
doc_784,2018,SOR/2015-26,"Railway Safety Management System Regulations, 2015",2015,2015,P.C.,railway,no topic,railway
doc_786,2018,"C.R.C., c. 754","Order Respecting the Remission of Customs Duties Imposed under the Customs Tariff and Taxes Imposed under Division III of Part IX and under any other Part of The Excise Tax Act, Underpaid Due to Error on Customs Accounting Document",2005,NA,,export,export,exports
doc_787,2018,SOR/98-40,Order Designating Certain Countries and Military Service Agencies for the Purposes of Tariff Item No. 9810.00.00,2008,1997,P.C.,housing,no topic,estate / land
doc_792,2018,SOR/95-588,Order Fixing the Rate of Premium that Persons Employed in Insurable Employment are Required to Pay for the Year 1996,NA,1995,P.C.,national park,no topic,national park
doc_795,2018,SOR/84-764,Order Authorizing the Minister of Regional Industrial Expansion to Exercise the Powers of the Minister of Fisheries and Oceans under Subsection 6(1) of the Act with Respect to Certain Companies,2005,1984,P.C.,fishery,no topic,fishery
doc_796,2018,SOR/2016-77,"Order Establishing the Text of a Resolution Providing for the Postponement of the Coming into Force of Subsections 5.1(2), 6(2), 7(2), 8(2), 9(2), 10(2), 11(2) and 12(2) of the Fair Rail for Grain Farmers Act",2016,2016,P.C.,pension,food / agriculture,pension
doc_797,2018,SOR/95-563,"Regulations Respecting the Returns and Information To Be Submitted by Persons Exporting Oil, Gas or Electricity or Importing Gas",2008,1995,P.C.,export,no topic,exports
doc_798,2018,SOR/2002-16,Radiocommunication Act (Paragraph 9(1)(c)) Exemption Order (National Defence and Security),2008,2001,P.C.,export,fabric,exports
doc_799,2018,"C.R.C., c. 218",Order Granting Authority to Regulate the Marketing in Interprovincial and Export Trade of Onions Produced in Ontario,2005,NA,,poultry / food,baby products,agriculture / food
doc_800,2018,SOR/98-568,The Jacques-Cartier and Champlain Bridges Inc. Regulations,2006,1998,P.C.,pension,champlain bridge,pension
doc_801,2018,SOR/2005-37,Order Approving Blood Sample Containers,2005,2005,,firearm,no topic,firearms
doc_802,2018,SOR/2018-66,Regulations Respecting Reduction in the Release of Methane and Certain Volatile Organic Compounds (Upstream Oil and Gas Sector),2018,2018,P.C.,hydrocarbon facility / equipments,no topic,energy / pipeline / oil
doc_804,2018,SOR/2007-125,Vessel Clearance Regulations,2007,2007,P.C.,vessel / cargo,no topic,ship / vessel
doc_805,2018,"C.R.C., c. 224",Regulations Respecting the Marketing in Interprovincial and Export Trade of Wheat Produced in Ontario,2005,NA,,financial,no topic,finance
doc_806,2018,SOR/2005-23,Reporting of Exported Goods Regulations,2005,2005,P.C.,export,no topic,exports
doc_808,2018,SOR/91-134,Regulations Respecting the Determination of the Entitlement of Persons Detained by the Canadian Forces to Prisoner-of-War Status,2008,1991,,detainee,no topic,criminal code / immunity
doc_812,2018,SOR/82-791,Regulations Respecting the Insurance of Loans Made to Maislin Industries Ltd.,2006,1982,P.C.,detainee,no topic,criminal code / immunity
doc_813,2018,SOR/2002-65,CIFTA Remission Order,2008,2002,P.C.,export,tariff,exports
doc_814,2018,SOR/88-527,Order Respecting the Marketing in Interprovincial and Export Trade of Turkey Produced in Manitoba,2005,1988,,food,no topic,agriculture / food
doc_815,2018,"C.R.C., c. 243",Order Granting Authority to Regulate the Marketing in Interprovincial and Export Trade of Flue-Cured Tobacco Produced in Quebec,2005,NA,,poultry / food,coast guard / communication,agriculture / food
doc_816,2018,SOR/2013-214,CEFTA Verification of Origin of Exported Goods Regulations,2013,2013,P.C.,verification,drilling / energy,verification
doc_818,2018,SOR/2003-200,Return of Packaged Alcohol to an Excise Warehouse Regulations,2005,2003,P.C.,hydrocarbon facility / equipments,no topic,energy / pipeline / oil
doc_819,2018,SOR/2017-142,CUFTA Tariff Preference Regulations,2017,2017,P.C.,export,drilling / energy,exports
doc_820,2018,SOR/95-538,"Regulations Prescribing the Travel Documents for Which Fees are Payable and the Amount of Those Fees, with a View to the Recovery of Costs of Providing Consular Services",2005,1995,P.C.,pension,travel document,pension
doc_822,2018,SOR/98-33,Most-Favoured-Nation Tariff Rules of Origin Regulations,2005,1997,P.C.,export,tariff,exports
doc_823,2018,"C.R.C., c. 1448",Order Specifying Certain Waters on the Sea Coasts of Canada as Minor Waters,2005,NA,,fabric,no topic,apparel / textile
doc_825,2018,SOR/87-603,Regulations Respecting Zoning at La Ronge Airport,2011,1987,P.C.,runway,no topic,runway
doc_828,2018,SOR/86-438,"Regulations Respecting the Issuing of, Accounting for, Repayment and Recovery of Accountable Advances",2010,1986,T.B.,finance,no topic,finance
doc_830,2018,"C.R.C., c. 1312",Order Respecting the Privileges and Immunities in Canada of the Inter-American Development Bank,2005,NA,,immunity,no topic, criminal code / immunity
doc_831,2018,"C.R.C., c. 1306",Order Respecting the Privileges and Immunities of the Caribbean Development Bank in Canada,2005,NA,,airport,immunity,airport / aircrafts
doc_832,2018,SOR/2006-15,Order Authorizing Persons Specified Therein to Be Parties to Certain Commercial Arrangements and Providing Specific Directives to the Vancouver Port Authority and the Fraser River Port Authority,2006,2006,P.C.,vessel,no topic,ship / vessel
doc_833,2018,SOR/94-501,Order Prescribing Charges To Be Paid for Ship/Shore Communications Services Provided by Coast Guard Radio Stations,2008,1994,,coast guard / communication,no topic,communication
doc_835,2018,SOR/91-444,"Regulations Respecting the Management and Proper Use of the St. Andrews Lock, Dam, Bridge and Related Facilities at Lockport, Manitoba",2006,1991,P.C.,vessel,no topic,ship / vessel
doc_836,2018,SOR/2012-205,"Marketing Authorization for Food Additives That May Be Used as Emulsifying, Gelling, Stabilizing or Thickening Agents",2012,2012,,food,no topic,agriculture / food
doc_837,2018,SOR/92-91,Order Granting Authority to the Office des producteurs d’agneaux et de moutons du Québec to Regulate the Marketing of Sheep snd Wool Produced in the Province of Quebec in Interprovincial and Export Trade,2005,1992,P.C.,poultry / food,poultry / marketing,agriculture / food
doc_838,2018,SOR/99-278,Disclosure of Charges (Authorized Foreign Banks) Regulations,2005,1999,P.C.,bank / finance,no topic,bank / finance
doc_839,2018,SOR/2012-211,"Marketing Authorization for Food Additives That May Be Used as pH Adjusting Agents, Acid-Reacting Materials or Water Correcting Agents",2012,2012,,food,no topic,agriculture / food
doc_840,2018,SOR/2014-283,CJFTA Verification of Origin Regulations,2014,2014,P.C.,verification,no topic,verification
doc_842,2018,SOR/82-550,Order Prescribing the Fees to be Paid by Persons in the Private Sector for Services Provided in Relation to the Certification of Canadian Films and Video Tapes,2011,1982,,pension,bank / finance,pension
doc_843,2018,SOR/2015-5,Canada – Newfoundland and Labrador Offshore Area Diving Operations Safety Transitional Regulations,2015,2015,,diving operation,no topic,diving operation
doc_844,2018,SOR/2016-184,Pacifiers Regulations,2016,2016,P.C.,baby products,no topic,baby products
doc_845,2018,SOR/2009-277,Order Designating Ontario for the Purposes of the Criminal Interest Rate Provisions of the Criminal Code,2009,2009,P.C.,ontario,no topic,ontario
doc_846,2018,SOR/2014-254,Products Containing Mercury Regulations,2014,2014,P.C.,mercury,no topic,mercury
doc_847,2018,SOR/55-416,Regulations — Defence Services Pension Act — Part V,2005,1955,P.C.,pension,no topic,pension
doc_848,2018,SOR/2006-190,"Exemption Order for Certain Licences, Authorizations and Documents (White Sturgeon)",2006,2006,P.C.,fishery,no topic,fishery
doc_850,2018,SOR/2010-116,"Radiocommunication Act (subsection 4(1) and paragraph 9(1)(b)) Exemption Order (Security, Safety and International Relations), No. 2010–4",2010,2010,P.C.,export,no topic,exports
doc_852,2018,SOR/2016-190,Residential Detectors Regulations,2016,2016,P.C.,fire alarm / smoke detector,no topic,fire alarm / smoke detector
doc_853,2018,SOR/91-8,"Regulations Respecting the Designation of Towns, Visitor Centres and Resort Subdivisions in National Parks",2008,1990,P.C.,national park,no topic,national park
doc_854,2018,SOR/95-100,"Regulations Respecting the Issuance of Certificates of Fitness for Petroleum Production, Drilling, Accommodation and Diving Installations in Areas Offshore Newfoundland",2006,1995,P.C.,diving operation,drilling,diving operation
doc_855,2018,SOR/2010-65,"Telecommunications Fees Regulations, 2010",2010,2010,,pension,telecommunication,pension
doc_856,2018,SOR/2002-359,Precursor Control Regulations,2006,2002,P.C.,permit / export,no topic,exports
doc_860,2018,SOR/75-24,Regulations Prescribing the Terms and Conditions in Respect of Home Buyer Grants,2006,1974,P.C.,housing,no topic,estate / land
doc_861,2018,SOR/82-381,Regulations Respecting the Determination and Payment out of the Foreign Claims Fund of Certain claims against the Government of the People’s Republic of China,2006,1982,P.C.,claims,no topic,claims
doc_862,2018,SOR/2013-162,Least Developed Country Tariff Withdrawal Order (2013 GPT Review),2013,2013,P.C.,export,financial,exports
doc_863,2018,SOR/99-318,Canada Port Authority Environmental Assessment Regulations,2008,1999,P.C.,environmental assessment / project,no topic,environment
doc_864,2018,"C.R.C., c. 135","Order Providing for the Fixing, Imposing and Collecting of Levies from Certain Turkey Producers in Alberta",2005,NA,,food,no topic,agriculture / food
doc_865,2018,SOR/83-810,Regulations Respecting Steering Appliances and Equipment,2010,1983,P.C.,diving operation,detainee,diving operation
doc_867,2018,SOR/2003-31,Regulations Prescribing Alternative Means of Publication (Foreign Companies),2005,2003,P.C.,railway,permit / export,railway
doc_869,2018,"C.R.C., c. 647",Canadian Turkey Marketing Agency Proclamation,2010,NA,,poultry / food,no topic,agriculture / food
doc_873,2018,SOR/97-62,Regulations Defining Certain Expressions for the Purposes of the Customs Tariff,2008,1996,P.C.,export,fuel / emissions / electricity,exports
doc_874,2018,SOR/82-361a,"Order Approving the Exclusion by the Public Service Commission of all Positions and Employees of the Staff of the Non-Public Funds, Canadian Forces from the Operation of the Public Service Employment Act",2011,1982,P.C.,pension,housing,pension
doc_875,2018,SOR/92-356,Regulations Defining Certain Expressions and Prescribing Certain International Agencies in Respect of Commercial Loans,2008,1992,P.C.,bank / debt,no topic,bank / debt
doc_876,2018,SOR/2008-138,Outward Processing Remission Order (Textiles and Apparel),2008,2008,P.C.,apparel,no topic,apparel / textile
doc_877,2018,SOR/86-766,Order Respecting the Delegation of Powers Conferred on the Minister of National Revenue by Sections 131 to 133 of the Customs Act,2005,1986,,custom / national revenue,no topic,economics
doc_878,2018,"C.R.C., c. 690",Regulations Under Section 52 of the Financial Administration Act Respecting Loans of Defence Materiel,2005,NA,,airport,no topic,airport / aircrafts
doc_880,2018,SOR/2011-265,Personal Health Information Custodians in New Brunswick Exemption Order,2011,2011,P.C.,airport,no topic,airport / aircrafts
doc_881,2018,SOR/2017-87,Order Declaring an Amnesty Period (2017),2017,2017,P.C.,pension,firearm,pension
doc_884,2018,SOR/2009-317,Nova Scotia Offshore Petroleum Drilling and Production Regulations,2009,2009,P.C.,drilling / energy,no topic,energy / pipeline / oil
doc_885,2018,SOR/88-447,Regulations Respecting Zoning at Kingston Airport,2011,1988,P.C.,airport,no topic,airport / aircrafts
doc_887,2018,SOR/95-302,Order Authorizing a Certain Employee of the Government of Canada to Acquire an Interest in Territorial Lands in the Northwest Territories,2006,1995,P.C.,fire alarm / smoke detector,no topic,fire alarm / smoke detector
doc_888,2018,SOR/98-447,Regulations Defining “Advertising Revenues”,2008,1998,,poultry / food,no topic,agriculture / food
doc_889,2018,SOR/2000-60,Portions of the Canada Ports Corporation Divestiture Regulations,2008,2000,T.B.,pension,fabric,pension
doc_890,2018,SOR/93-384,"Order Extending the Privileges and Immunities of Members of the Administrative and Technical Staff of the Embassy of the United States, and Members of their Families, in Canada",2005,1993,,privilege immunity,no topic, criminal code / immunity
doc_892,2018,SOR/2016-231,Cannabis Exemption (Food and Drugs Act) Regulations,2016,2016,P.C.,cannabis / food,no topic,cannabis / drugs
doc_893,2018,SOR/2003-374,Organizations in the Province of Quebec Exemption Order,2005,2003,P.C.,electronic,export,electronic document
doc_894,2018,SOR/2012-167,Reduction of Carbon Dioxide Emissions from Coal-fired Generation of Electricity Regulations,2012,2012,P.C.,fuel / emissions / electricity,no topic,environment
doc_897,2018,SOR/96-202,Order Authorizing a Certain Employee of the Government of Canada to Acquire an Interest in Territorial Lands in the Northwest Territories,2008,1996,P.C.,fire alarm / smoke detector,no topic,fire alarm / smoke detector
doc_898,2018,SOR/67-346,Regulations Respecting the Dry Docks of Canadian Vickers Limited,2016,1967,P.C.,vessel / ships,no topic,ship / vessel
doc_902,2018,SOR/94-27,Order According Reciprocal Protection to Switzerland under the Act,2008,1994,,integrated circuit,no topic,integrated circuit
doc_903,2018,SOR/93-409,Regulations Respecting Zoning at Gillam Airport,2011,1993,P.C.,runway,airport,runway
doc_905,2018,SOR/2008-306,2010 Olympic and Paralympic Winter Games Remission Order,2008,2008,P.C.,claims,no topic,claims
doc_907,2018,"C.R.C., c. 487",Regulations Respecting a Drawback on Customs Duties Paid on Woven Fabrics Used in the Manufacture of Men’s and Boys’ Shirts,2005,NA,,fabric,no topic,apparel / textile
doc_908,2018,SOR/2014-137,"International Development Association, International Finance Corporation and Multilateral Investment Guarantee Agency Privileges and Immunities Order",2014,2014,P.C.,international agreement,no topic,international policy
doc_912,2018,SOR/93-408,Regulations Respecting Zoning at Swift Current Airport,2011,1993,P.C.,airport,drilling,airport / aircrafts
doc_913,2018,SOR/93-420,Regulations Respecting Broadcasting Information Requirements,2005,1993,,housing,no topic,estate / land
doc_914,2018,SOR/82-627,Regulations Respecting the Insurance of Loans Made to the Lake Group Ltd.,2006,1982,P.C.,detainee,no topic,criminal code / immunity
doc_915,2018,SOR/88-485,Regulations Respecting the Carrying into Effect of the Diplomatic Service (Special) Superannuation Act,NA,1988,P.C.,detainee,no topic,criminal code / immunity
doc_916,2018,SOR/2009-92,Regulations Implementing the United Nations Resolutions on Somalia,2009,2009,P.C.,united nation,no topic,united nation
doc_917,2018,SOR/2002-172,Vessels Registry Fees Tariff,2006,2002,P.C.,pension,food,pension
doc_919,2018,"C.R.C., c. 322",Regulations Respecting Payments in Lieu of Development and Redevelopment Taxes on Federal Property,2006,NA,,property supply,property,estate / land
doc_920,2018,SOR/2013-35,"Exemption Order for Certain Licences, Authorizations and Documents (Westslope Cutthroat Trout (Alberta Population))",2013,2013,P.C.,cannabis,tariff,cannabis / drugs
doc_921,2018,SOR/98-308,Theratronics International Limited Divestiture Regulations,2008,1998,P.C.,property supply,display panel,estate / land
doc_922,2018,SOR/84-886,Regulations Respecting the Stoppage of Pay and Allowances of Members of the Royal Canadian Mounted Police who are Suspended from Duty,2005,1984,T.B.,property,no topic,estate / land
doc_923,2018,"C.R.C., c. 450",Regulations Respecting the Redemption of Subsidiary Coin,2005,NA,,property supply,trade / commerce,estate / land
doc_924,2018,SOR/2016-230,Access to Cannabis for Medical Purposes Regulations,2016,2016,P.C.,cannabis,no topic,cannabis / drugs
doc_925,2018,SOR/98-446,Divestiture of Service Transitional Coverage Regulations,2008,1998,T.B.,property supply,superannuation,estate / land
doc_926,2018,"C.R.C., c. 478",Regulations Respecting Special Customs and Excise Services,2006,NA,,property supply,drilling / energy,estate / land
doc_927,2018,SOR/93-385,Regulations Respecting Zoning at Aklavik Airport,2011,1993,P.C.,airport,airport,airport / aircrafts
doc_928,2018,SOR/93-391,"Order Extending Duty and Tax Relief Privileges to Members of the Administrative and Technical Staff of the Embassy of the United States, and Members of their Families, in Canada",2005,1993,P.C.,public work,no topic,public work
doc_929,2018,SOR/95-465,Order Respecting Australia and New Zealand Rates of Customs Duty,2009,1995,P.C.,tariff / free trade,no topic,tariff
doc_933,2018,SOR/2004-321,Nunavut Sex Offender Information Registration Regulations,2008,2004,,tariff / free trade,no topic,tariff
doc_934,2018,SOR/84-5,Regulations Respecting Zoning at Hamilton Airport,2011,1983,P.C.,airport,no topic,airport / aircrafts
doc_935,2018,SOR/2009-316,Newfoundland Offshore Petroleum Drilling and Production Regulations,2009,2009,P.C.,drilling / energy,no topic,energy / pipeline / oil
doc_937,2018,"C.R.C., c. 691",Regulations Under Section 52 of the Financial Administration Act Respecting Loans or Transfers of Defence Materiel for Test and Evaluation Purposes,2005,NA,,property supply,airport,estate / land
doc_938,2018,SOR/2014-321,Allocation Method Order (2015) — Softwood Lumber Products,2015,2014,,baby products / crib,no topic,baby products
doc_939,2018,SOR/82-1015,Regulations Respecting the Prevention of Electric Sparks that May Cause Fire During the Transfer of Flammable Liquids or Compressed Flammable Gases Between Units of Railway Rolling Stock and Stationary Bulk Storage Facilities,2011,1982,,railway / flammable liquid,no topic,railway
doc_940,2018,SOR/97-63,CIFTA Rules of Origin Regulations,2006,1996,P.C.,change,no topic,change
doc_941,2018,SOR/2001-258,"Order Authorizing Federal Employees to Acquire Interests in Certain Lands in the Northwest Territories (Order No. 1, 2001)",2008,2001,P.C.,marketing,no topic,marketing
doc_942,2018,SOR/92-343,Regulations Respecting Zoning at Repulse Bay Airport,2005,1992,P.C.,airport,airport,airport / aircrafts
doc_943,2018,SOR/97-77,General Import Permit No. 193 — Roses,2008,1996,,permit,no topic,permit
doc_945,2018,SOR/2002-416,Regulations Respecting Applications for Ministerial Review — Miscarriages of Justice,2008,2002,P.C.,application,no topic,application
doc_946,2018,"C.R.C., c. 646",Canadian Egg Marketing Agency Proclamation,2012,NA,,marketing,no topic,marketing
doc_948,2018,SOR/2010-58,Haiti Deemed Direct Shipment (General Preferential Tariff and Least Developed Country Tariff) Regulations,2010,2010,P.C.,change,tariff,change
