doc_num,consolidationyear,instrumentNumber,longtitle,modifiedyear,registrationyear,regulationmaker,topic 1,topic 2,overarching topic
doc_0,2018,SOR/2017-109,Environmental Violations Administrative Monetary Penalties Regulations,2017,2017,P.C.,environment / violation,no topic,environment
doc_1,2018,SOR/85-567,Regulations Respecting Mailable Matter Bearing No Postage or Insufficient Postage,NA,1985,P.C.,postage,no topic,postal service
doc_2,2018,SOR/93-293,Regulations Respecting Zoning at Bagotville Airport,2011,1993,P.C.,airport,no topic,airport / aircrafts
doc_3,2018,SOR/98-87,"Shirting Fabrics Remission Order, 1998",2005,1997,P.C.,fashion / textile,no topic,apparel / textile
doc_4,2018,"C.R.C., c. 208",Regulations Respecting the Marketing in Interprovincial and Export Trade of Greenhouse Vegetables Produced in Ontario,2005,NA,,greenhouse / marketing,no topic,greenhouse
doc_5,2018,SOR/98-578,Proclamation declaring that the ,2005,1998,,violation,no topic,violation
doc_7,2018,SOR/86-1135,Zoning Regulations Respecting Deer Lake Airport,2011,1986,P.C.,airport,no topic,airport / aircrafts
doc_9,2018,SOR/2007-121,Proceeds of Crime (Money Laundering) and Terrorist Financing Registration Regulations,2007,2007,P.C.,entity registration,no topic,entity
doc_13,2018,SOR/2017-121,Locomotive Emissions Regulations,2017,2017,P.C.,locomotive,no topic,automobile
doc_14,2018,SOR/57-216,Regulations Respecting Section 12 of the Dominion Succession Duty Act,2005,1957,P.C.,airport,fashion / textile,airport / aircrafts
doc_15,2018,SOR/93-522,Regulations Respecting Zoning at St. Leonard Airport,2011,1993,P.C.,directions,airport,directions
doc_16,2018,SOR/91-74,"Order Authorizing the Maximum Amounts that May Be Paid in the Year 1991 as Benefits under Sections 24, 25 and 26 of the Unemployment Insurance Act",2008,1990,P.C.,finance / insurance,no topic,finance
doc_17,2018,SOR/98-50,Diversion of Imported Goods Exemption Regulations,2005,1997,P.C.,fishery,no topic,fishery
doc_19,2018,SOR/98-44,"Determination, Re-Determination and Further Re-Determination of Origin, Tariff Classification and Value for Duty Regulations",2005,1997,P.C.,airport,no topic,airport / aircrafts
doc_20,2018,"C.R.C., c. 1359",Regulations Made Pursuant to Subsection 32(10) of the Public Service Superannuation Act,2005,NA,,superannuation,no topic,superannuation
doc_24,2018,SOR/2011-91,Deposit Out of the Normal Course of Events Notification Regulations,2011,2011,P.C.,environment / agriculture,no topic,environment
doc_26,2018,SOR/82-719,Order Granting Authority to Regulate the Marketing in Interprovincial and Export Trade of Wheat Produced in Nova Scotia,2011,1982,P.C.,poultry / food,marketing,agriculture / food
doc_27,2018,SOR/2005-232,Order Authorizing Negotiations for the Settlement of the Dispute Causing the Extraordinary Disruption of the National Transportation System in Relation to Container Movements into and out of Certain Ports in British Columbia,2005,2005,P.C.,port authority,beneficiary,port authority
doc_29,2018,SOR/2011-170,Public Servants Disclosure Protection Tribunal Rules of Procedure,2011,2011,,branch closure,no topic,branch closure
doc_30,2018,SOR/2005-226,Proclamation Exempting Tom MacKay Lake from the Operation of Section 22 of the Act,2006,2005,,finance / insurance,no topic,finance
doc_31,2018,"C.R.C., c. 591","Regulations Respecting the Calculation of Deductions, Refunds or Payments by the Minister Equal to Consumption or Sales Tax",2005,NA,,superannuation,no topic,superannuation
doc_33,2018,SOR/94-562,Order Respecting the Privileges and Immunities in Canada of the North Pacific Anadromous Fish Commission,2008,1994,P.C.,information / bank,no topic,bank / finance
doc_35,2018,"C.R.C., c. 778",Order Respecting the Remission of Customs Duty on Perfluorinated Ion-Exchange Membranes,2005,NA,,settler,no topic,settler
doc_37,2018,SOR/82-296,Regulations Respecting Zoning at Norman Wells Airport,2011,1982,P.C.,directions,airport,directions
doc_38,2018,SOR/2001-399,Manner of Calculation (Foreign Banks) Regulations,2008,2001,P.C.,foreign entity / bank,no topic,foreign policy
doc_39,2018,SOR/2012-17,General Import Permit No. 80 — Carbon Steel,2012,2012,,substance dealer licence,insurance company,licence
doc_40,2018,SOR/92-282,Regulations Prescribing Classes of Persons the Members of Which are Resident Canadians,2005,1992,P.C.,insurance company,no topic,insurance
doc_41,2018,SOR/2008-67,Prescribed Deposits (Retail Associations Without Deposit Insurance) Regulations,2008,2008,P.C.,internal labour,retail association / deposit,employment
doc_43,2018,SOR/2015-36,Radiocommunication Act (Subsection 4(4) and Paragraph 9(1)(,2015,2015,,substance dealer licence,radio communication,licence
doc_44,2018,SOR/2016-124,National Energy Board Pipeline Damage Prevention Regulations – Authorizations,2016,2016,,pipeline / energy,no topic,energy / pipeline / oil
doc_45,2018,SOR/2001-57,Supervisory Information (Cooperative Credit Associations) Regulations,2005,2001,P.C.,information / bank,no topic,bank / finance
doc_46,2018,SOR/2002-266,Support Orders and Support Provisions (Trust and Loan Companies) Regulations,2007,2002,P.C.,wastewater system,firearm,water
doc_51,2018,SOR/96-117,Regulations Respecting Geophysical Operations in Relation to Exploration for Oil and Gas in any Area to which the Canada Oil and Gas Operations Act Applies,2011,1996,P.C.,geophysical operation,no topic,geography
doc_56,2018,SOR/2009-214,CPFTA Rules of Origin Regulations,2009,2009,P.C.,entity registration,no topic,entity
doc_57,2018,SOR/2009-200,CEFTA Tariff Preference Regulations,2009,2009,P.C.,shipping route,agriculture,ship / vessel
doc_58,2018,SOR/86-895,Regulations Respecting the Telecommunication Programming Services Tax,2010,1986,,nuclear / ontario hydro,no topic,nuclear
doc_60,2018,SOR/2001-366,"Ancillary Activities (Insurance Companies, Canadian Societies and Insurance Holding Companies) Regulations",2008,2001,P.C.,insurance company,no topic,insurance
doc_61,2018,"C.R.C., c. 793",Order Respecting the Remission of Excise Duty on Spirits Destroyed by Accident,2005,NA,,chemicals,no topic,chemicals
doc_63,2018,"C.R.C., c. 1601",Regulations Made Pursuant to the War Service Grants Act,2005,NA,,radioactive material / packaging,no topic,nuclear
doc_64,2018,SOR/2010-161,Regulations Prescribing Certain Offences to be Serious Offences,2010,2010,P.C.,finance / offence,no topic,finance
doc_65,2018,SOR/81-235,Regulations Prescribing the Notice of Objection Form To Be Used by a Company that Objects to an Assessment Under Section 26 of the Northern Pipeline Act,2016,1981,P.C.,northern pipeline,no topic,energy / pipeline / oil
doc_68,2018,SOR/81-547,"Regulations Respecting the Disposition of Certain Property Under the Control, Management and Administration of the Minister of National Revenue",2010,1981,P.C.,first nation / property,property,first nation
doc_69,2018,SOR/89-421,Regulations Respecting the Fees To Be Paid by the Commissioner of the Bermuda Police Force for Services Provided by the Forensic Laboratory Services and Identification Services of the Royal Canadian Mounted Police,2011,1989,P.C.,police force,no topic,police
doc_72,2018,SOR/2013-101,Administrative Monetary Penalties (Consumer Products) Regulations,2013,2013,P.C.,violation,no topic,violation
doc_74,2018,SOR/86-922,Regulations Respecting the Movement in Trains of Service Equipment Cars,2011,1986,,railway,no topic,railway
doc_75,2018,SOR/99-409,Order respecting Privileges and Immunities in relation to the Preparatory Commission for the Comprehensive Nuclear Test-Ban Treaty Organization and its Provisional Technical Secretariat,2008,1999,P.C.,preparatory commission,no topic,preparatory commission
doc_76,2018,SOR/2007-243,First Nations Taxation Enforcement Regulations,2007,2007,P.C.,first nation / property,no topic,first nation
doc_78,2018,SOR/99-384,Exemption from Deposit Insurance By-law (Foreign Currency Deposits),2008,1999,,retail association / deposit,no topic,retail
doc_82,2018,"C.R.C., c. 803",Regulations Exempting Certain Carriers from Application of Paragraphs 21(1)(b) and (c) of the Freshwater Fish Marketing Act,2005,NA,,corporation,no topic,corporations
doc_83,2018,SOR/2007-294,Olympic and Paralympic Marks Regulations,2008,2007,P.C.,olympic,no topic,sports
doc_84,2018,SOR/85-188,Regulations Respecting Zoning at Peace River Airport,2011,1985,P.C.,directions,directions,directions
doc_85,2018,SOR/2001-206,Radiocommunication Act (Paragraph 9(1)(c)) Exemption Order,2008,2001,P.C.,preparatory commission,no topic,preparatory commission
doc_87,2018,SOR/2008-167,Prescribed Group of Consumers Regulations,2008,2008,P.C.,internal labour,no topic,employment
doc_89,2018,SOR/92-309,Regulations Prescribing Certain Transactions  and Classes of Transactions that a Bank may  Enter into with Related Parties of the Bank,2005,1992,P.C.,bank / textile,no topic,bank / finance
doc_91,2018,SOR/2002-138,Moose Jaw Airport Zoning Regulations,2011,2002,P.C.,directions,no topic,directions
doc_93,2018,SOR/83-481,Regulations Prescribing a Definition for the Word Letter,2010,1983,P.C.,documents,no topic,communication
doc_95,2018,SOR/99-145,Alberta Chicken Order,2005,1999,P.C.,poultry / food,poultry / food,agriculture / food
doc_97,2018,"C.R.C., c. 1588","Regulations Delegating Powers Conferred by Parts I and II of the Veterans’ Land Act upon the Director, the Veterans’ Land Act",2005,NA,,first nation / property,property,first nation
doc_98,2018,SOR/2012-138,Firearms Information Regulations (Non-restricted Firearms),2012,2012,P.C.,firearm,no topic,firearms
doc_100,2018,SOR/93-481,"Regulations Prescribing the Fee for Fingerprinting for the Purposes of a Visa, Licence or Security Clearance",2008,1993,P.C.,pipeline / energy,no topic,energy / pipeline / oil
doc_101,2018,SOR/2002-104,Notice of Branch Closure (Banks) Regulations,2005,2002,P.C.,branch closure,no topic,branch closure
doc_104,2018,SOR/2006-246,Statistical Data Disclosure Regulations,2006,2006,P.C.,poultry / food,no topic,agriculture / food
doc_105,2018,"C.R.C., c. 340",REGULATIONS RESPECTING THE REIMBURSEMENT OF PROVINCES FOR MONEYS PAID TO OWNERS OF ANIMALS DYING AS A RESULT OF RABIES,2006,NA,,finance / insurance,greenhouse,finance
doc_106,2018,SOR/2006-252,Period for Entering into an Agreement for the Purpose of Jointly Establishing a Review Panel Regulations,2006,2006,P.C.,precautions,no topic,precautions
doc_109,2018,SOR/93-65,"Order Exempting the Proposed Acquisition of an Increased Interest in Greyhound Lines of Canada Ltd. from the Application of Part VII of the National Transportation Act, 1987",2008,1993,P.C.,transportation,no topic,transport
doc_110,2018,SOR/96-275,Regulations Prescribing Transactions that an Association May Enter Into with a Related Party of the Association,2008,1996,P.C.,wage,no topic,employment
doc_111,2018,SOR/2009-162,"Chromium Electroplating, Chromium Anodizing and Reverse Etching Regulations",2009,2009,P.C.,chemicals / chromium,no topic,chemicals
doc_112,2018,SOR/2000-217,Benzodiazepines and Other Targeted Substances Regulations,2008,2000,P.C.,substance dealer licence,no topic,licence
doc_115,2018,SOR/2004-155,Schedule 1 Chemicals Regulations (Chemical Weapons Convention),NA,2004,P.C.,licence / chemicals,no topic,licence
doc_116,2018,"C.R.C., c. 1563",Regulations Respecting the Disposal of Personal Property Left at Airports,2005,NA,,airport,no topic,airport / aircrafts
doc_117,2018,SOR/86-1082,Guidelines Respecting the Application of Section 11 of the Canadian Human Rights Act and Prescribing Factors Justifying Different Wages for Work of Equal Value,2005,1986,,wage,no topic,employment
doc_118,2018,SOR/2010-203,"Certain Ships Remission Order, 2010",2010,2010,P.C.,remission,no topic,remission
doc_122,2018,SOR/96-249,Regulations Prescribing the Time and Manner of Making Fiscal Equalization Offset Payments in Respect of Offshore Revenue to Her Majesty in Right of Nova Scotia,2008,1996,P.C.,finance / insurance,no topic,finance
doc_123,2018,SOR/2005-353,Hunter Douglas Canada Remission Order,2009,2005,P.C.,wastewater system,no topic,water
doc_124,2018,SOR/2009-177,Order Designating Nova Scotia for the Purposes of the Criminal Interest Rate Provisions of the Criminal Code,2009,2009,P.C.,poultry / food,no topic,agriculture / food
doc_126,2018,SOR/2010-202,"Tankers and Cargo Vessels Remission Order, 2010",2010,2010,P.C.,remission,no topic,remission
doc_127,2018,SOR/2005-347,Public Service Official Languages Appointment Regulations,2008,2005,C.P.,airport / language,no topic,airport / aircrafts
doc_129,2018,SOR/93-325,Regulations Respecting Zoning at Gjoa Haven Airport,2011,1993,P.C.,airport,airport,airport / aircrafts
doc_130,2018,SOR/98-380,Order Respecting the First Legislative Assembly of Nunavut,2008,1998,P.C.,directions,no topic,directions
doc_131,2018,SOR/89-187,Order Authorizing the Minister of Finance to Exercise the Powers of the Minister of Fisheries and Oceans Referred to in the Act in Respect of National Sea Products Limited,2005,NA,,fishery,no topic,fishery
doc_134,2018,SOR/87-701,Order Providing for the Fixing and Imposing of Levies on Pulse Crops Produced in Saskatchewan and Marketed in Interprovincial and Export Trade,2011,1987,,environment / agriculture,no topic,environment
doc_135,2018,SOR/2016-5,North American Foreign Ministers Meeting 2016 — Privileges and Immunities Order,2016,2016,P.C.,chemicals / chromium,no topic,chemicals
doc_136,2018,"C.R.C., c. 427",Order Designating a Member of the Queen’s Privy Council for Canada to Act as the Minister for the Purposes of the Canada Business Corporations Act,2005,NA,,internal labour,no topic,employment
doc_137,2018,SOR/98-419,Imports of Certain Textile and Apparel Goods from Chile Customs Duty Remission Order,2008,1998,P.C.,free trade,no topic,trade
doc_138,2018,SOR/2002-105,Notice of Branch Closure (Cooperative Credit Associations) Regulations,2008,2002,P.C.,branch closure,no topic,branch closure
doc_141,2018,"C.R.C., c. 355",Order Delegating Power and Authority Under Section 26 of the Arctic Waters Pollution Prevention Act,2005,NA,,trade,no topic,trade
doc_142,2018,SOR/2012-139,Wastewater Systems Effluent Regulations,2012,2012,P.C.,wastewater system,no topic,water
doc_143,2018,SOR/90-225,Order Respecting the Exemption of Certain Goods or Classes of Goods from Certain Requirements Specified in Tariff Item No. 9807.00.00,2008,1990,P.C.,settler,no topic,settler
doc_144,2018,SOR/93-480,Regulations Prescribing the Fees To Be Paid for the Use of Royal Canadian Mounted Police Forensic Laboratory Services,2008,1993,P.C.,forensic / police,no topic,police
doc_145,2018,SOR/95-360,Order Respecting the Remission of the Tax Imposed Under Division III of Part IX of the Excise Tax Act on Printed Material Imported for Use by Foreign Carriers,2006,1995,P.C.,insurance company,no topic,insurance
doc_146,2018,SOR/90-231,Regulations Respecting the Establishment of a Quota System by which Quotas Are Assigned by Provincial Commodity Boards to Turkey Producers for the Marketing of Turkey in Interprovincial and Export Trade,2006,1990,,poultry / food,no topic,agriculture / food
doc_148,2018,SOR/99-144,St. Lawrence Seaway Authority Divestiture Regulations,2008,1999,T.B.,foreign entity / bank,no topic,foreign policy
doc_151,2018,SOR/2015-145,"Packaging and Transport of Nuclear Substances Regulations, 2015",2015,2015,P.C.,radioactive material / packaging,no topic,nuclear
doc_152,2018,SOR/2004-99,Rules of Practice and Procedure of the Tax Court of Canada in Respect of Appeals Under Part V.1 of the Customs Act (Informal Procedure),2007,2004,P.C.,court appeal,no topic,appeal / hearing
doc_154,2018,"C.R.C., c. 180",Order Granting Authority to Regulate the Marketing in Interprovincial and Export Trade of Chickens Produced in Ontario,2005,NA,,poultry / food,poultry / food,agriculture / food
doc_155,2018,SOR/2005-151,Canada Education Savings Regulations,2005,2005,P.C.,beneficiary,no topic,beneficiary
doc_157,2018,SOR/87-259,Regulations Respecting Interruption of Postal Services,2010,1987,P.C.,branch closure,postal service,branch closure
doc_161,2018,SOR/98-182,Ontario Hydro Nuclear Facilities Exclusion Regulations (Use of Tobacco),2008,1998,P.C.,nuclear / ontario hydro,no topic,nuclear
doc_162,2018,SOR/97-503,"Les Collections Shan Remission Order, 1997",2008,1997,P.C.,bank / textile,no topic,bank / finance
doc_166,2018,SOR/2007-242,First Nations Assessment Inspection Regulations,2007,2007,P.C.,first nation / property,wastewater system,first nation
doc_167,2018,SOR/89-408,"Order Respecting the Exemption of Lawrence Bay Airways Ltd. from the Application of Subparagraph 72(2)(a)(i) of the National Transportation Act, 1987",2011,1989,,infrastructure,no topic,infrastructure
doc_168,2018,SOR/2007-256,Eligible Financial Contract General Rules (Bankruptcy and Insolvency Act),2007,2007,P.C.,company property,security,corporations
doc_170,2018,SOR/2010-13,"G8 Summit Privileges and Immunities Order, No. 2010-2",2010,2010,P.C.,preparatory meeting,no topic,preparatory meeting
doc_171,2018,SOR/81-552,Order Respecting the Fees to be Charged for Issuing Multiple-Unit Residential Building Construction Starts Certificates,2011,1981,,commodity,no topic,commodities
doc_173,2018,"C.R.C., c. 1600",ORDER AUTHORIZING PERSONS TO RECEIVE A WAR SERVICE GRATUITY ON BEHALF OF INFANTS OR PERSONS OF UNSOUND MIND,NA,NA,,fishery licence,no topic,fishery
doc_174,2018,SOR/2001-401,Minority Investment (Bank Holding Companies) Regulations,2005,2001,P.C.,company property,bank / finance,corporations
doc_175,2018,SOR/2004-222,United Nations Democratic Republic of the Congo Regulations,2006,2004,P.C.,united nation,no topic,united nation
doc_177,2018,SOR/2014-236,Special Economic Measures (South Sudan) Permit Authorization Order,2014,2014,P.C. ,economic measures,no topic,economics
doc_178,2018,SOR/2009-215,CPFTA Rules of Origin for Casual Goods Regulations,2009,2009,P.C.,company property,goods,corporations
doc_179,2018,"C.R.C., c. 786",Order Respecting the Remission of Taxes Paid or Payable Under Division III of Part IX and Under any Other Part of the Excise Tax Act and Customs Duties Paid or Payable Under Section 21 of the Customs Tariff on Samples of Negligible Value,2005,NA,,finance / investment,business,finance
doc_181,2018,SOR/2010-148,Student Employment Programs Participants Regulations,2010,2010,P.C.,employment program,no topic,employment
doc_183,2018,SOR/79-818,Order Granting Authority to Regulate the Marketing of Tree Fruit in British Columbia,2011,1979,P.C.,finance / investment,scientific research,finance
doc_186,2018,SOR/2012-267,Disclosure on Continuance Regulations (Federal Credit Unions),2012,2012,P.C.,bank / finance,no topic,bank / finance
doc_187,2018,SOR/2008-66,Prescribed Deposits (Trust and Loan Companies Without Deposit Insurance) Regulations,2008,2008,P.C.,company property,united nation,corporations
doc_188,2018,SOR/2001-398,Investment Limits (Trust and Loan Companies) Regulations,2006,2001,P.C.,company property,no topic,corporations
doc_190,2018,SOR/92-283,Regulations Prescribing Classes of Persons the Members of which are Resident Canadians,2008,1992,P.C., wood producer,no topic,wood production
doc_191,2018,SOR/51-84,Application of Defence Services Pension Act to Special Force,2005,1951,P.C.,army,no topic,army / defence
doc_192,2018,SOR/92-297,Regulations Permitting Companies to Permit their Subsidiaries to Hold Shares of the Company,2008,1992,P.C.,company property, wood producer,corporations
doc_193,2018,SOR/94-563,Order Respecting the Privileges and Immunities in Canada of the International Civil Aviation Organization (ICAO),2008,1994,P.C.,privilege immunity,no topic, criminal code / immunity
doc_195,2018,SOR/2008-210,Prosecution of Provincial Offences Regulations (Donkin Coal Block),2008,2008,P.C.,offenses,first nation,offenses
doc_196,2018,SOR/2000-376,Regulations Maintaining Certain Reciprocal Transfer Agreements,2008,2000,T.B.,united nation,no topic,united nation
doc_198,2018,SOR/2001-171,Selected Listed Financial Institutions Attribution Method (GST/HST) Regulations,2006,2001,P.C.,finance / investment,no topic,finance
doc_199,2018,SOR/2011-90,Release and Environmental Emergency Notification Regulations,2011,2011,P.C.,environment / migratory bird,no topic,environment
doc_202,2018,SOR/96-40,Regulations Respecting Ships’ Stores,2005,1996,P.C.,tobacco,no topic,tobacco
doc_205,2018,SOR/96-68,Regulations Prescribing Persons and Organizations,2008,1996,P.C.,tobacco,no topic,tobacco
doc_207,2018,SOR/2003-289,"Federal Halocarbon Regulations, 2003",2009,2003,P.C.,chemicals,no topic,chemicals
doc_209,2018,SOR/97-107,General Export Permit No. 12 — United States Origin Goods,2005,1997,,airport / tariff,export,airport / aircrafts
doc_210,2018,SOR/91-75,Order Authorizing Petro-Canada Limited and its Wholly-Owned Subsidiaries to Undertake Certain Transactions During 1991,2006,1990,P.C.,finance / investment,subsidiary,finance
doc_211,2018,SOR/93-523,Regulations Respecting Zoning at Coppermine Airport,2011,1993,P.C.,airport / tariff,airport,airport / aircrafts
doc_214,2018,SOR/2007-134,Public Opinion Research Contract Regulations,2007,2007,P.C.,interest rate,scientific research,interest rate
doc_216,2018,"C.R.C., c. 221","Order Providing for the Fixing, Imposing and Collecting of Levies from Certain Turkey Producers in Ontario",2005,NA,,commodity,commodity,commodities
doc_217,2018,SOR/78-148,Special Voting Rules,2005,1978,,employer,no topic,employment
doc_218,2018,SOR/90-379,Order Respecting the Accelerated Reduction or Removal of Certain Customs Duties Under the Customs Tariff as a Consequence of Concessions Granted Pursuant to the Canada-United States Free Trade Agreement,2010,1990,P.C.,airport / tariff,no topic,airport / aircrafts
doc_219,2018,"C.R.C., c. 209",Regulations Respecting the Pricing in Interprovincial and Export Trade of Greenhouse Vegetables Produced in Ontario,2005,NA,,bank / finance,no topic,bank / finance
doc_221,2018,SOR/98-86,"Outerwear Greige Fabrics Remission Order, 1998",2005,1997,P.C.,fashion / textile,no topic,apparel / textile
doc_222,2018,SOR/90-351,Regulations Respecting the Management of Contaminated Fisheries,2006,1990,P.C.,fishery licence,no topic,fishery
doc_224,2018,SOR/2017-108,"Designation of Regulatory Provisions for Purposes of Enforcement (Migratory Birds Convention Act, 1994) Regulations",2017,2017,P.C.,environment / migratory bird,no topic,environment
doc_226,2018,SOR/2006-319,Prospectus (Cooperative Credit Associations) Regulations,2007,2006,P.C.,security,bank / finance,security
doc_227,2018,SOR/2016-70,Joint Notice Specifying the Prohibition Period For Certain Activities on Georges Bank,2016,2016,,finance / investment,petroleum,finance
doc_228,2018,SOR/98-90,"Outerwear Fabrics Remission Order, 1998",2005,1997,P.C.,fashion / textile,no topic,apparel / textile
doc_229,2018,SOR/2002-11,"Order Authorizing Federal Employees to Acquire Interests in Certain Lands in the Northwest Territories (Order No. 05, 2001)",2008,2001,P.C.,tobacco,no topic,tobacco
doc_231,2018,SOR/2005-30,Secure Electronic Signature Regulations,2005,2005,P.C.,electronic document / signature,no topic,electronic document
doc_232,2018,SOR/2003-274,Chicken Farmers of Canada Delegation of Authority Order,2008,2003,P.C.,finance / investment,poultry / food,finance
doc_234,2018,"C.R.C., c. 237",Regulations Respecting the Directed Sales Flow in Interprovincial and Export Trade of Vegetable Produced in Prince Edward Island,2005,NA,,finance / investment,food / agriculture,finance
doc_236,2018,SOR/95-558,Regulations Respecting Zoning at Greenwood Airport,2011,1995,P.C.,airport / tariff,employer,airport / aircrafts
doc_237,2018,SOR/91-168,Order Prescribing the Fee for Processing Applications Submitted to the Canadian Heraldic Authority for the Grant of Coats of Arms,2008,1991,,finance / investment,goods,finance
doc_239,2018,SOR/2018-75,Nova Scotia Hog Marketing Levies (Interprovincial and Export Trade) Order,2018,2018,,levy / marketing,no topic,levy / marketing
doc_241,2018,SOR/87-663,"Order Respecting the Fixing and Imposing of Levies on, and the Collecting of Levies From, Producers of Wood in the Labelle Area in the Province of Quebec, With Respect to the Marketing of Wood in Interprovincial and Export Trade",2011,1987,, wood producer,no topic,wood production
doc_242,2018,SOR/98-47,Tariff Item Nos. 9971.00.00 and 9992.00.00 Accounting Regulations,NA,1997,P.C.,environment / migratory bird,no topic,environment
doc_243,2018,SOR/96-470,Employment Equity Regulations,2005,1996,P.C.,employer,no topic,employment
doc_244,2018,SOR/88-590,Order Varying CTC Abandonment Orders Respecting the Avonlea Subdivision Between Parry and Avonlea,2005,1988,P.C.,refinery,no topic,energy / pipeline / oil
doc_245,2018,SOR/83-253,Regulations Respecting Zoning at Abbotsford Airport,2011,1983,P.C.,airport / tariff,no topic,airport / aircrafts
doc_246,2018,SOR/2011-86,Fort William First Nation Sawmill Regulations,2011,2011,P.C.,first nation,no topic,first nation
doc_247,2018,SOR/2008-212,Order Designating Manitoba for the Purposes of the Criminal Interest Rate Provisions of the Criminal Code,2008,2008,P.C.,finance / investment,army / defence,finance
doc_249,2018,SOR/83-509,Regulations Respectingt the Insurance of Loans Made to Cheticamp/Grand Etang Fishermen’s Co-Operative Society Limited,2006,1983,P.C.,company property,finance / investment,corporations
doc_250,2018,SOR/96-42,"Regulations Respecting the Refund and Drawback of Duties Paid in Respect of Imported Goods Subsequently Exported, in Respect of Imported Goods Processed in Canada and Subsequently Exported and in Respect of Imported Goods Used, Consumed or Expended in the Processing in Canada of Goods Subsequently Exported",2009,1996,P.C.,company property,no topic,corporations
